Question,Subject,Chapter,Years_Appeared,Frequency,Average_Marks,,Priority,Is_Augmented,Source_Question
"Briefly, derive an expression for electric and magnetic components of a short dipole antenna if the spherical system is defined in r, theta and phi.",Antennas and Propagation,2. Radiation of Electric dipole,"Summer 2023, Winter 2024",2,7,,High,TRUE,"Derive an expression for electric and magnetic components of a short dipole antenna if the spherical system is defined in r, theta and phi."
"Obtain an expression for electric and magnetic components of a short dipole antenna if the spherical system is defined in r, theta and phi.",Antennas and Propagation,2. Radiation of Electric dipole,"Summer 2023, Winter 2024",2,7,,High,TRUE,"Derive an expression for electric and magnetic components of a short dipole antenna if the spherical system is defined in r, theta and phi."
"In brief, deduce an expression for electric and magnetic components of a short dipole antenna if the spherical system is defined in r, theta and phi.",Antennas and Propagation,2. Radiation of Electric dipole,"Summer 2023, Winter 2024",2,7,,High,TRUE,"Derive an expression for electric and magnetic components of a short dipole antenna if the spherical system is defined in r, theta and phi."
"Concisely, derive an expression for electric and magnetic components of a short dipole antenna if the spherical system is defined in r, theta and phi.",Antennas and Propagation,2. Radiation of Electric dipole,"Summer 2023, Winter 2024",2,7,,High,TRUE,"Derive an expression for electric and magnetic components of a short dipole antenna if the spherical system is defined in r, theta and phi."
"In brief, derive the expression for the radiation resistance of half-wave dipole and prove that it is 73 Ohm.",Antennas and Propagation,2. Radiation of Electric dipole,"Winter 2021, Winter 2022, Summer 2024, Winter 2024, Winter 2025",5,7,,High,TRUE,Derive the expression for the radiation resistance of half-wave dipole and prove that it is 73 Ohm.
"In short, derive the expression for the radiation resistance of half-wave dipole and prove that it is 73 Ohm.",Antennas and Propagation,2. Radiation of Electric dipole,"Winter 2021, Winter 2022, Summer 2024, Winter 2024, Winter 2025",5,7,,High,TRUE,Derive the expression for the radiation resistance of half-wave dipole and prove that it is 73 Ohm.
"Briefly, obtain the expression for the radiation resistance of half-wave dipole and prove that it is 73 Ohm.",Antennas and Propagation,2. Radiation of Electric dipole,"Winter 2021, Winter 2022, Summer 2024, Winter 2024, Winter 2025",5,7,,High,TRUE,Derive the expression for the radiation resistance of half-wave dipole and prove that it is 73 Ohm.
"To summarize, deduce the expression for the radiation resistance of half-wave dipole and prove that it is 73 Ohm.",Antennas and Propagation,2. Radiation of Electric dipole,"Winter 2021, Winter 2022, Summer 2024, Winter 2024, Winter 2025",5,7,,High,TRUE,Derive the expression for the radiation resistance of half-wave dipole and prove that it is 73 Ohm.
Deduce the expression for the radiation resistance of half-wave dipole and prove that it is 73 Ohm.,Antennas and Propagation,2. Radiation of Electric dipole,"Winter 2021, Winter 2022, Summer 2024, Winter 2024, Winter 2025",5,7,,High,TRUE,Derive the expression for the radiation resistance of half-wave dipole and prove that it is 73 Ohm.
"To summarize, derive the far field components and radiation resistance of a small circular loop.",Antennas and Propagation,2. Radiation of Electric dipole,"Winter 2021, Summer 2024, Winter 2024, Summer 2025, Winter 2025",5,7,,High,TRUE,Derive the far field components and radiation resistance of a small circular loop.
"In short, derive the far field components and radiation resistance of a small circular loop.",Antennas and Propagation,2. Radiation of Electric dipole,"Winter 2021, Summer 2024, Winter 2024, Summer 2025, Winter 2025",5,7,,High,TRUE,Derive the far field components and radiation resistance of a small circular loop.
Obtain the far field components and radiation resistance of a small circular loop.,Antennas and Propagation,2. Radiation of Electric dipole,"Winter 2021, Summer 2024, Winter 2024, Summer 2025, Winter 2025",5,7,,High,TRUE,Derive the far field components and radiation resistance of a small circular loop.
"Briefly, obtain the far field components and radiation resistance of a small circular loop.",Antennas and Propagation,2. Radiation of Electric dipole,"Winter 2021, Summer 2024, Winter 2024, Summer 2025, Winter 2025",5,7,,High,TRUE,Derive the far field components and radiation resistance of a small circular loop.
"Concisely, obtain the far field components and radiation resistance of a small circular loop.",Antennas and Propagation,2. Radiation of Electric dipole,"Winter 2021, Summer 2024, Winter 2024, Summer 2025, Winter 2025",5,7,,High,TRUE,Derive the far field components and radiation resistance of a small circular loop.
"In short, obtain the far field components of a monopole antenna.",Antennas and Propagation,2. Radiation of Electric dipole,Winter 2025,1,7,,Low,TRUE,Derive the far field components of a monopole antenna.
"Briefly, derive the far field components of a monopole antenna.",Antennas and Propagation,2. Radiation of Electric dipole,Winter 2025,1,7,,Low,TRUE,Derive the far field components of a monopole antenna.
"To summarize, obtain the far field components of a monopole antenna.",Antennas and Propagation,2. Radiation of Electric dipole,Winter 2025,1,7,,Low,TRUE,Derive the far field components of a monopole antenna.
"In short, derive the far field components of a monopole antenna.",Antennas and Propagation,2. Radiation of Electric dipole,Winter 2025,1,7,,Low,TRUE,Derive the far field components of a monopole antenna.
Obtain the far field components of a monopole antenna.,Antennas and Propagation,2. Radiation of Electric dipole,Winter 2025,1,7,,Low,TRUE,Derive the far field components of a monopole antenna.
"Concisely, deduce reciprocity theorem for antennas. Show that the transmitting and receiving radiation patterns of an antenna are equal.",Antennas and Propagation,2. Radiation of Electric dipole,Winter 2021,1,7,,Low,TRUE,Derive reciprocity theorem for antennas. Show that the transmitting and receiving radiation patterns of an antenna are equal.
"To summarize, derive reciprocity theorem for antennas. Show that the transmitting and receiving radiation patterns of an antenna are equal.",Antennas and Propagation,2. Radiation of Electric dipole,Winter 2021,1,7,,Low,TRUE,Derive reciprocity theorem for antennas. Show that the transmitting and receiving radiation patterns of an antenna are equal.
Obtain reciprocity theorem for antennas. Show that the transmitting and receiving radiation patterns of an antenna are equal.,Antennas and Propagation,2. Radiation of Electric dipole,Winter 2021,1,7,,Low,TRUE,Derive reciprocity theorem for antennas. Show that the transmitting and receiving radiation patterns of an antenna are equal.
"Briefly, deduce reciprocity theorem for antennas. Show that the transmitting and receiving radiation patterns of an antenna are equal.",Antennas and Propagation,2. Radiation of Electric dipole,Winter 2021,1,7,,Low,TRUE,Derive reciprocity theorem for antennas. Show that the transmitting and receiving radiation patterns of an antenna are equal.
"Briefly, obtain reciprocity theorem for antennas. Show that the transmitting and receiving radiation patterns of an antenna are equal.",Antennas and Propagation,2. Radiation of Electric dipole,Winter 2021,1,7,,Low,TRUE,Derive reciprocity theorem for antennas. Show that the transmitting and receiving radiation patterns of an antenna are equal.
"In short, calculate the radiation resistance if the effective height of the aerial is 1/100th of the length of wave emitted.",Antennas and Propagation,2. Radiation of Electric dipole,Winter 2022,1,3,,Low,TRUE,Calculate the radiation resistance if the effective height of the aerial is 1/100th of the length of wave emitted.
"In brief, calculate the radiation resistance if the effective height of the aerial is 1/100th of the length of wave emitted.",Antennas and Propagation,2. Radiation of Electric dipole,Winter 2022,1,3,,Low,TRUE,Calculate the radiation resistance if the effective height of the aerial is 1/100th of the length of wave emitted.
Find the radiation resistance if the effective height of the aerial is 1/100th of the length of wave emitted.,Antennas and Propagation,2. Radiation of Electric dipole,Winter 2022,1,3,,Low,TRUE,Calculate the radiation resistance if the effective height of the aerial is 1/100th of the length of wave emitted.
"In short, compute the radiation resistance if the effective height of the aerial is 1/100th of the length of wave emitted.",Antennas and Propagation,2. Radiation of Electric dipole,Winter 2022,1,3,,Low,TRUE,Calculate the radiation resistance if the effective height of the aerial is 1/100th of the length of wave emitted.
"Briefly, find the radiation resistance if the effective height of the aerial is 1/100th of the length of wave emitted.",Antennas and Propagation,2. Radiation of Electric dipole,Winter 2022,1,3,,Low,TRUE,Calculate the radiation resistance if the effective height of the aerial is 1/100th of the length of wave emitted.
"To summarize, explain the following antenna parameters: Beam solid angle, Directivity, Antenna Aperture, Half Power Beamwidth, Radiation intensity, Antenna radiation efficiency, and Effective length.",Antennas and Propagation,3. Antenna parameters and definitions,"Winter 2021, Winter 2021, Summer 2022, Winter 2022, Summer 2023, Winter 2023, Winter 2023, Summer 2024, Winter 2024, Winter 2024, Summer 2025, Winter 2025",12,3.83,,High,TRUE,"Define the following antenna parameters: Beam solid angle, Directivity, Antenna Aperture, Half Power Beamwidth, Radiation intensity, Antenna radiation efficiency, and Effective length."
"Concisely, explain the following antenna parameters: Beam solid angle, Directivity, Antenna Aperture, Half Power Beamwidth, Radiation intensity, Antenna radiation efficiency, and Effective length.",Antennas and Propagation,3. Antenna parameters and definitions,"Winter 2021, Winter 2021, Summer 2022, Winter 2022, Summer 2023, Winter 2023, Winter 2023, Summer 2024, Winter 2024, Winter 2024, Summer 2025, Winter 2025",12,3.83,,High,TRUE,"Define the following antenna parameters: Beam solid angle, Directivity, Antenna Aperture, Half Power Beamwidth, Radiation intensity, Antenna radiation efficiency, and Effective length."
"Briefly, define the following antenna parameters: Beam solid angle, Directivity, Antenna Aperture, Half Power Beamwidth, Radiation intensity, Antenna radiation efficiency, and Effective length.",Antennas and Propagation,3. Antenna parameters and definitions,"Winter 2021, Winter 2021, Summer 2022, Winter 2022, Summer 2023, Winter 2023, Winter 2023, Summer 2024, Winter 2024, Winter 2024, Summer 2025, Winter 2025",12,3.83,,High,TRUE,"Define the following antenna parameters: Beam solid angle, Directivity, Antenna Aperture, Half Power Beamwidth, Radiation intensity, Antenna radiation efficiency, and Effective length."
"Concisely, define the following antenna parameters: Beam solid angle, Directivity, Antenna Aperture, Half Power Beamwidth, Radiation intensity, Antenna radiation efficiency, and Effective length.",Antennas and Propagation,3. Antenna parameters and definitions,"Winter 2021, Winter 2021, Summer 2022, Winter 2022, Summer 2023, Winter 2023, Winter 2023, Summer 2024, Winter 2024, Winter 2024, Summer 2025, Winter 2025",12,3.83,,High,TRUE,"Define the following antenna parameters: Beam solid angle, Directivity, Antenna Aperture, Half Power Beamwidth, Radiation intensity, Antenna radiation efficiency, and Effective length."
"Briefly, describe the following antenna parameters: Beam solid angle, Directivity, Antenna Aperture, Half Power Beamwidth, Radiation intensity, Antenna radiation efficiency, and Effective length.",Antennas and Propagation,3. Antenna parameters and definitions,"Winter 2021, Winter 2021, Summer 2022, Winter 2022, Summer 2023, Winter 2023, Winter 2023, Summer 2024, Winter 2024, Winter 2024, Summer 2025, Winter 2025",12,3.83,,High,TRUE,"Define the following antenna parameters: Beam solid angle, Directivity, Antenna Aperture, Half Power Beamwidth, Radiation intensity, Antenna radiation efficiency, and Effective length."
Obtain the expression of Friis transmission formula and explain how it determines loss between two antennas.,Antennas and Propagation,3. Antenna parameters and definitions,"Winter 2021, Summer 2022, Winter 2023, Summer 2024, Winter 2024, Summer 2025",6,6.5,,High,TRUE,Derive the expression of Friis transmission formula and explain how it determines loss between two antennas.
"In short, obtain the expression of Friis transmission formula and explain how it determines loss between two antennas.",Antennas and Propagation,3. Antenna parameters and definitions,"Winter 2021, Summer 2022, Winter 2023, Summer 2024, Winter 2024, Summer 2025",6,6.5,,High,TRUE,Derive the expression of Friis transmission formula and explain how it determines loss between two antennas.
"In brief, derive the expression of Friis transmission formula and explain how it determines loss between two antennas.",Antennas and Propagation,3. Antenna parameters and definitions,"Winter 2021, Summer 2022, Winter 2023, Summer 2024, Winter 2024, Summer 2025",6,6.5,,High,TRUE,Derive the expression of Friis transmission formula and explain how it determines loss between two antennas.
"Concisely, obtain the expression of Friis transmission formula and explain how it determines loss between two antennas.",Antennas and Propagation,3. Antenna parameters and definitions,"Winter 2021, Summer 2022, Winter 2023, Summer 2024, Winter 2024, Summer 2025",6,6.5,,High,TRUE,Derive the expression of Friis transmission formula and explain how it determines loss between two antennas.
"In short, deduce the expression of Friis transmission formula and explain how it determines loss between two antennas.",Antennas and Propagation,3. Antenna parameters and definitions,"Winter 2021, Summer 2022, Winter 2023, Summer 2024, Winter 2024, Summer 2025",6,6.5,,High,TRUE,Derive the expression of Friis transmission formula and explain how it determines loss between two antennas.
"Concisely, enlist and discuss about various antenna field zones with figures.",Antennas and Propagation,3. Antenna parameters and definitions,"Winter 2021, Summer 2024, Winter 2024, Summer 2025, Winter 2025",5,3.4,,High,TRUE,Enlist and discuss about various antenna field zones with figures.
"Concisely, enumerate and discuss about various antenna field zones with figures.",Antennas and Propagation,3. Antenna parameters and definitions,"Winter 2021, Summer 2024, Winter 2024, Summer 2025, Winter 2025",5,3.4,,High,TRUE,Enlist and discuss about various antenna field zones with figures.
"In brief, enumerate and discuss about various antenna field zones with figures.",Antennas and Propagation,3. Antenna parameters and definitions,"Winter 2021, Summer 2024, Winter 2024, Summer 2025, Winter 2025",5,3.4,,High,TRUE,Enlist and discuss about various antenna field zones with figures.
"In brief, enlist and discuss about various antenna field zones with figures.",Antennas and Propagation,3. Antenna parameters and definitions,"Winter 2021, Summer 2024, Winter 2024, Summer 2025, Winter 2025",5,3.4,,High,TRUE,Enlist and discuss about various antenna field zones with figures.
"To summarize, enlist and discuss about various antenna field zones with figures.",Antennas and Propagation,3. Antenna parameters and definitions,"Winter 2021, Summer 2024, Winter 2024, Summer 2025, Winter 2025",5,3.4,,High,TRUE,Enlist and discuss about various antenna field zones with figures.
"In brief, deduce the relation between Directivity and Beam area.",Antennas and Propagation,3. Antenna parameters and definitions,Summer 2023,1,4,,Low,TRUE,Derive the relation between Directivity and Beam area.
"Concisely, obtain the relation between Directivity and Beam area.",Antennas and Propagation,3. Antenna parameters and definitions,Summer 2023,1,4,,Low,TRUE,Derive the relation between Directivity and Beam area.
"In brief, obtain the relation between Directivity and Beam area.",Antennas and Propagation,3. Antenna parameters and definitions,Summer 2023,1,4,,Low,TRUE,Derive the relation between Directivity and Beam area.
"In short, deduce the relation between Directivity and Beam area.",Antennas and Propagation,3. Antenna parameters and definitions,Summer 2023,1,4,,Low,TRUE,Derive the relation between Directivity and Beam area.
Obtain the relation between Directivity and Beam area.,Antennas and Propagation,3. Antenna parameters and definitions,Summer 2023,1,4,,Low,TRUE,Derive the relation between Directivity and Beam area.
"Briefly, distinguish Gain and Directivity.",Antennas and Propagation,3. Antenna parameters and definitions,Summer 2024,1,3,,Low,TRUE,Differentiate Gain and Directivity.
"Concisely, compare Gain and Directivity.",Antennas and Propagation,3. Antenna parameters and definitions,Summer 2024,1,3,,Low,TRUE,Differentiate Gain and Directivity.
"In short, differentiate Gain and Directivity.",Antennas and Propagation,3. Antenna parameters and definitions,Summer 2024,1,3,,Low,TRUE,Differentiate Gain and Directivity.
Distinguish Gain and Directivity.,Antennas and Propagation,3. Antenna parameters and definitions,Summer 2024,1,3,,Low,TRUE,Differentiate Gain and Directivity.
"To summarize, compare Gain and Directivity.",Antennas and Propagation,3. Antenna parameters and definitions,Summer 2024,1,3,,Low,TRUE,Differentiate Gain and Directivity.
"Concisely, find the HPBW, FNBW, beam area, and directivity for given field patterns (e.g., E(theta) = cos^2(theta) or Pn(theta) = cos^3(theta)).",Antennas and Propagation,3. Antenna parameters and definitions,"Winter 2023, Summer 2025",2,4,,Medium,TRUE,"Find the HPBW, FNBW, beam area, and directivity for given field patterns (e.g., E(theta) = cos^2(theta) or Pn(theta) = cos^3(theta))."
"In short, calculate the HPBW, FNBW, beam area, and directivity for given field patterns (e.g., E(theta) = cos^2(theta) or Pn(theta) = cos^3(theta)).",Antennas and Propagation,3. Antenna parameters and definitions,"Winter 2023, Summer 2025",2,4,,Medium,TRUE,"Find the HPBW, FNBW, beam area, and directivity for given field patterns (e.g., E(theta) = cos^2(theta) or Pn(theta) = cos^3(theta))."
"Concisely, determine the HPBW, FNBW, beam area, and directivity for given field patterns (e.g., E(theta) = cos^2(theta) or Pn(theta) = cos^3(theta)).",Antennas and Propagation,3. Antenna parameters and definitions,"Winter 2023, Summer 2025",2,4,,Medium,TRUE,"Find the HPBW, FNBW, beam area, and directivity for given field patterns (e.g., E(theta) = cos^2(theta) or Pn(theta) = cos^3(theta))."
"In short, determine the HPBW, FNBW, beam area, and directivity for given field patterns (e.g., E(theta) = cos^2(theta) or Pn(theta) = cos^3(theta)).",Antennas and Propagation,3. Antenna parameters and definitions,"Winter 2023, Summer 2025",2,4,,Medium,TRUE,"Find the HPBW, FNBW, beam area, and directivity for given field patterns (e.g., E(theta) = cos^2(theta) or Pn(theta) = cos^3(theta))."
"Briefly, determine the HPBW, FNBW, beam area, and directivity for given field patterns (e.g., E(theta) = cos^2(theta) or Pn(theta) = cos^3(theta)).",Antennas and Propagation,3. Antenna parameters and definitions,"Winter 2023, Summer 2025",2,4,,Medium,TRUE,"Find the HPBW, FNBW, beam area, and directivity for given field patterns (e.g., E(theta) = cos^2(theta) or Pn(theta) = cos^3(theta))."
"Briefly, describe the difference between radian and steradian and show that one steradian is 3282 square degrees.",Antennas and Propagation,3. Antenna parameters and definitions,Winter 2023,1,4,,Low,TRUE,Explain the difference between radian and steradian and show that one steradian is 3282 square degrees.
"To summarize, explain the difference between radian and steradian and show that one steradian is 3282 square degrees.",Antennas and Propagation,3. Antenna parameters and definitions,Winter 2023,1,4,,Low,TRUE,Explain the difference between radian and steradian and show that one steradian is 3282 square degrees.
"Concisely, describe the difference between radian and steradian and show that one steradian is 3282 square degrees.",Antennas and Propagation,3. Antenna parameters and definitions,Winter 2023,1,4,,Low,TRUE,Explain the difference between radian and steradian and show that one steradian is 3282 square degrees.
"In short, explain the difference between radian and steradian and show that one steradian is 3282 square degrees.",Antennas and Propagation,3. Antenna parameters and definitions,Winter 2023,1,4,,Low,TRUE,Explain the difference between radian and steradian and show that one steradian is 3282 square degrees.
"Concisely, discuss the difference between radian and steradian and show that one steradian is 3282 square degrees.",Antennas and Propagation,3. Antenna parameters and definitions,Winter 2023,1,4,,Low,TRUE,Explain the difference between radian and steradian and show that one steradian is 3282 square degrees.
"To summarize, what do you mean by isotropic radiator? Compare it with omnidirectional radiator.",Antennas and Propagation,3. Antenna parameters and definitions,Summer 2023,1,4,,Low,TRUE,What do you mean by isotropic radiator? Compare it with omnidirectional radiator.
"Concisely, what do you mean by isotropic radiator? Compare it with omnidirectional radiator.",Antennas and Propagation,3. Antenna parameters and definitions,Summer 2023,1,4,,Low,TRUE,What do you mean by isotropic radiator? Compare it with omnidirectional radiator.
"In brief, what do you mean by isotropic radiator? Compare it with omnidirectional radiator.",Antennas and Propagation,3. Antenna parameters and definitions,Summer 2023,1,4,,Low,TRUE,What do you mean by isotropic radiator? Compare it with omnidirectional radiator.
"In short, what do you mean by isotropic radiator? Compare it with omnidirectional radiator.",Antennas and Propagation,3. Antenna parameters and definitions,Summer 2023,1,4,,Low,TRUE,What do you mean by isotropic radiator? Compare it with omnidirectional radiator.
"Briefly, what do you mean by isotropic radiator? Compare it with omnidirectional radiator.",Antennas and Propagation,3. Antenna parameters and definitions,Summer 2023,1,4,,Low,TRUE,What do you mean by isotropic radiator? Compare it with omnidirectional radiator.
Deduce the mathematical expression for the radiation intensity of an isotropic radiator.,Antennas and Propagation,3. Antenna parameters and definitions,Winter 2025,1,3,,Low,TRUE,Derive the mathematical expression for the radiation intensity of an isotropic radiator.
"Concisely, derive the mathematical expression for the radiation intensity of an isotropic radiator.",Antennas and Propagation,3. Antenna parameters and definitions,Winter 2025,1,3,,Low,TRUE,Derive the mathematical expression for the radiation intensity of an isotropic radiator.
"To summarize, derive the mathematical expression for the radiation intensity of an isotropic radiator.",Antennas and Propagation,3. Antenna parameters and definitions,Winter 2025,1,3,,Low,TRUE,Derive the mathematical expression for the radiation intensity of an isotropic radiator.
"In brief, derive the mathematical expression for the radiation intensity of an isotropic radiator.",Antennas and Propagation,3. Antenna parameters and definitions,Winter 2025,1,3,,Low,TRUE,Derive the mathematical expression for the radiation intensity of an isotropic radiator.
"In short, obtain the mathematical expression for the radiation intensity of an isotropic radiator.",Antennas and Propagation,3. Antenna parameters and definitions,Winter 2025,1,3,,Low,TRUE,Derive the mathematical expression for the radiation intensity of an isotropic radiator.
"To summarize, show that the directivity of an infinitesimal dipole is 1.76dB (or 3/2).",Antennas and Propagation,3. Antenna parameters and definitions,"Winter 2022, Winter 2025",2,5.5,,Medium,TRUE,Show that the directivity of an infinitesimal dipole is 1.76dB (or 3/2).
"In short, show that the directivity of an infinitesimal dipole is 1.76dB (or 3/2).",Antennas and Propagation,3. Antenna parameters and definitions,"Winter 2022, Winter 2025",2,5.5,,Medium,TRUE,Show that the directivity of an infinitesimal dipole is 1.76dB (or 3/2).
"Concisely, show that the directivity of an infinitesimal dipole is 1.76dB (or 3/2).",Antennas and Propagation,3. Antenna parameters and definitions,"Winter 2022, Winter 2025",2,5.5,,Medium,TRUE,Show that the directivity of an infinitesimal dipole is 1.76dB (or 3/2).
"Briefly, show that the directivity of an infinitesimal dipole is 1.76dB (or 3/2).",Antennas and Propagation,3. Antenna parameters and definitions,"Winter 2022, Winter 2025",2,5.5,,Medium,TRUE,Show that the directivity of an infinitesimal dipole is 1.76dB (or 3/2).
"In brief, show that the directivity of an infinitesimal dipole is 1.76dB (or 3/2).",Antennas and Propagation,3. Antenna parameters and definitions,"Winter 2022, Winter 2025",2,5.5,,Medium,TRUE,Show that the directivity of an infinitesimal dipole is 1.76dB (or 3/2).
"In brief, derive the mathematical expression between maximum effective aperture and directivity.",Antennas and Propagation,3. Antenna parameters and definitions,Winter 2025,1,7,,Low,TRUE,Derive the mathematical expression between maximum effective aperture and directivity.
"In brief, obtain the mathematical expression between maximum effective aperture and directivity.",Antennas and Propagation,3. Antenna parameters and definitions,Winter 2025,1,7,,Low,TRUE,Derive the mathematical expression between maximum effective aperture and directivity.
