Question,Subject,Chapter,Years_Appeared,Frequency,Average_Marks,,Priority,Is_Augmented,Source_Question
"In short, obtain the mathematical expression between maximum effective aperture and directivity.",Antennas and Propagation,3. Antenna parameters and definitions,Winter 2025,1,7,,Low,TRUE,Derive the mathematical expression between maximum effective aperture and directivity.
"To summarize, obtain the mathematical expression between maximum effective aperture and directivity.",Antennas and Propagation,3. Antenna parameters and definitions,Winter 2025,1,7,,Low,TRUE,Derive the mathematical expression between maximum effective aperture and directivity.
"To summarize, derive the mathematical expression between maximum effective aperture and directivity.",Antennas and Propagation,3. Antenna parameters and definitions,Winter 2025,1,7,,Low,TRUE,Derive the mathematical expression between maximum effective aperture and directivity.
"Briefly, determine the directivity and gain when the input power is 125.66 mW and maximum radiation intensity is 200mW/unit solid angle.",Antennas and Propagation,3. Antenna parameters and definitions,Summer 2022,1,3,,Low,TRUE,Find the directivity and gain when the input power is 125.66 mW and maximum radiation intensity is 200mW/unit solid angle.
Calculate the directivity and gain when the input power is 125.66 mW and maximum radiation intensity is 200mW/unit solid angle.,Antennas and Propagation,3. Antenna parameters and definitions,Summer 2022,1,3,,Low,TRUE,Find the directivity and gain when the input power is 125.66 mW and maximum radiation intensity is 200mW/unit solid angle.
"Concisely, determine the directivity and gain when the input power is 125.66 mW and maximum radiation intensity is 200mW/unit solid angle.",Antennas and Propagation,3. Antenna parameters and definitions,Summer 2022,1,3,,Low,TRUE,Find the directivity and gain when the input power is 125.66 mW and maximum radiation intensity is 200mW/unit solid angle.
"In brief, find the directivity and gain when the input power is 125.66 mW and maximum radiation intensity is 200mW/unit solid angle.",Antennas and Propagation,3. Antenna parameters and definitions,Summer 2022,1,3,,Low,TRUE,Find the directivity and gain when the input power is 125.66 mW and maximum radiation intensity is 200mW/unit solid angle.
"Briefly, calculate the directivity and gain when the input power is 125.66 mW and maximum radiation intensity is 200mW/unit solid angle.",Antennas and Propagation,3. Antenna parameters and definitions,Summer 2022,1,3,,Low,TRUE,Find the directivity and gain when the input power is 125.66 mW and maximum radiation intensity is 200mW/unit solid angle.
"Briefly, illustrate the Radiation Pattern and write the relation between directivity and gain.",Antennas and Propagation,3. Antenna parameters and definitions,Summer 2025,1,4,,Low,TRUE,Draw the Radiation Pattern and write the relation between directivity and gain.
"In short, draw the Radiation Pattern and write the relation between directivity and gain.",Antennas and Propagation,3. Antenna parameters and definitions,Summer 2025,1,4,,Low,TRUE,Draw the Radiation Pattern and write the relation between directivity and gain.
"To summarize, draw the Radiation Pattern and write the relation between directivity and gain.",Antennas and Propagation,3. Antenna parameters and definitions,Summer 2025,1,4,,Low,TRUE,Draw the Radiation Pattern and write the relation between directivity and gain.
"In brief, illustrate the Radiation Pattern and write the relation between directivity and gain.",Antennas and Propagation,3. Antenna parameters and definitions,Summer 2025,1,4,,Low,TRUE,Draw the Radiation Pattern and write the relation between directivity and gain.
"In short, sketch the Radiation Pattern and write the relation between directivity and gain.",Antennas and Propagation,3. Antenna parameters and definitions,Summer 2025,1,4,,Low,TRUE,Draw the Radiation Pattern and write the relation between directivity and gain.
"Briefly, explain thoroughly about Binomial array and the principle of pattern multiplication for antenna arrays.",Antennas and Propagation,4. Arrays of point sources,"Winter 2021, Summer 2022, Summer 2023, Winter 2023, Winter 2024, Summer 2025, Summer 2025, Winter 2025",8,5.38,,High,TRUE,Explain in detail about Binomial array and the principle of pattern multiplication for antenna arrays.
"To summarize, describe in detail about Binomial array and the principle of pattern multiplication for antenna arrays.",Antennas and Propagation,4. Arrays of point sources,"Winter 2021, Summer 2022, Summer 2023, Winter 2023, Winter 2024, Summer 2025, Summer 2025, Winter 2025",8,5.38,,High,TRUE,Explain in detail about Binomial array and the principle of pattern multiplication for antenna arrays.
"Briefly, explain in detail about Binomial array and the principle of pattern multiplication for antenna arrays.",Antennas and Propagation,4. Arrays of point sources,"Winter 2021, Summer 2022, Summer 2023, Winter 2023, Winter 2024, Summer 2025, Summer 2025, Winter 2025",8,5.38,,High,TRUE,Explain in detail about Binomial array and the principle of pattern multiplication for antenna arrays.
"To summarize, explain in depth about Binomial array and the principle of pattern multiplication for antenna arrays.",Antennas and Propagation,4. Arrays of point sources,"Winter 2021, Summer 2022, Summer 2023, Winter 2023, Winter 2024, Summer 2025, Summer 2025, Winter 2025",8,5.38,,High,TRUE,Explain in detail about Binomial array and the principle of pattern multiplication for antenna arrays.
Explain in depth about Binomial array and the principle of pattern multiplication for antenna arrays.,Antennas and Propagation,4. Arrays of point sources,"Winter 2021, Summer 2022, Summer 2023, Winter 2023, Winter 2024, Summer 2025, Summer 2025, Winter 2025",8,5.38,,High,TRUE,Explain in detail about Binomial array and the principle of pattern multiplication for antenna arrays.
"Briefly, describe Dolph-Tchebysheff distribution for linear arrays.",Antennas and Propagation,4. Arrays of point sources,"Summer 2022, Winter 2023, Summer 2024",3,5,,High,TRUE,Discuss Dolph-Tchebysheff distribution for linear arrays.
"To summarize, explain Dolph-Tchebysheff distribution for linear arrays.",Antennas and Propagation,4. Arrays of point sources,"Summer 2022, Winter 2023, Summer 2024",3,5,,High,TRUE,Discuss Dolph-Tchebysheff distribution for linear arrays.
"In brief, discuss Dolph-Tchebysheff distribution for linear arrays.",Antennas and Propagation,4. Arrays of point sources,"Summer 2022, Winter 2023, Summer 2024",3,5,,High,TRUE,Discuss Dolph-Tchebysheff distribution for linear arrays.
"Briefly, discuss Dolph-Tchebysheff distribution for linear arrays.",Antennas and Propagation,4. Arrays of point sources,"Summer 2022, Winter 2023, Summer 2024",3,5,,High,TRUE,Discuss Dolph-Tchebysheff distribution for linear arrays.
"In short, discuss Dolph-Tchebysheff distribution for linear arrays.",Antennas and Propagation,4. Arrays of point sources,"Summer 2022, Winter 2023, Summer 2024",3,5,,High,TRUE,Discuss Dolph-Tchebysheff distribution for linear arrays.
"In brief, explain Schelkunoff theorems for linear arrays and its usefulness.",Antennas and Propagation,4. Arrays of point sources,"Summer 2023, Summer 2024",2,5.5,,High,TRUE,Explain Schelkunoff theorems for linear arrays and its usefulness.
"In brief, describe Schelkunoff theorems for linear arrays and its usefulness.",Antennas and Propagation,4. Arrays of point sources,"Summer 2023, Summer 2024",2,5.5,,High,TRUE,Explain Schelkunoff theorems for linear arrays and its usefulness.
"In short, explain Schelkunoff theorems for linear arrays and its usefulness.",Antennas and Propagation,4. Arrays of point sources,"Summer 2023, Summer 2024",2,5.5,,High,TRUE,Explain Schelkunoff theorems for linear arrays and its usefulness.
"To summarize, describe Schelkunoff theorems for linear arrays and its usefulness.",Antennas and Propagation,4. Arrays of point sources,"Summer 2023, Summer 2024",2,5.5,,High,TRUE,Explain Schelkunoff theorems for linear arrays and its usefulness.
Discuss Schelkunoff theorems for linear arrays and its usefulness.,Antennas and Propagation,4. Arrays of point sources,"Summer 2023, Summer 2024",2,5.5,,High,TRUE,Explain Schelkunoff theorems for linear arrays and its usefulness.
"In short, what do you mean by array? Discuss its types briefly.",Antennas and Propagation,4. Arrays of point sources,Summer 2023,1,3,,Low,TRUE,What do you mean by array? Discuss its types in brief.
What do you mean by array? Discuss its types in short.,Antennas and Propagation,4. Arrays of point sources,Summer 2023,1,3,,Low,TRUE,What do you mean by array? Discuss its types in brief.
"Concisely, what do you mean by array? Discuss its types briefly.",Antennas and Propagation,4. Arrays of point sources,Summer 2023,1,3,,Low,TRUE,What do you mean by array? Discuss its types in brief.
"Concisely, what do you mean by array? Discuss its types in brief.",Antennas and Propagation,4. Arrays of point sources,Summer 2023,1,3,,Low,TRUE,What do you mean by array? Discuss its types in brief.
"In short, what do you mean by array? Discuss its types in brief.",Antennas and Propagation,4. Arrays of point sources,Summer 2023,1,3,,Low,TRUE,What do you mean by array? Discuss its types in brief.
"Concisely, compare broadside array and endfire array, and describe their properties.",Antennas and Propagation,4. Arrays of point sources,"Winter 2021, Summer 2022, Winter 2022, Winter 2025",4,4.25,,High,TRUE,"Differentiate broadside array and endfire array, and describe their properties."
"Briefly, compare broadside array and endfire array, and describe their properties.",Antennas and Propagation,4. Arrays of point sources,"Winter 2021, Summer 2022, Winter 2022, Winter 2025",4,4.25,,High,TRUE,"Differentiate broadside array and endfire array, and describe their properties."
"Distinguish broadside array and endfire array, and describe their properties.",Antennas and Propagation,4. Arrays of point sources,"Winter 2021, Summer 2022, Winter 2022, Winter 2025",4,4.25,,High,TRUE,"Differentiate broadside array and endfire array, and describe their properties."
"In short, distinguish broadside array and endfire array, and describe their properties.",Antennas and Propagation,4. Arrays of point sources,"Winter 2021, Summer 2022, Winter 2022, Winter 2025",4,4.25,,High,TRUE,"Differentiate broadside array and endfire array, and describe their properties."
"In brief, differentiate broadside array and endfire array, and describe their properties.",Antennas and Propagation,4. Arrays of point sources,"Winter 2021, Summer 2022, Winter 2022, Winter 2025",4,4.25,,High,TRUE,"Differentiate broadside array and endfire array, and describe their properties."
"Concisely, obtain the expression for the far field pattern of an array of point sources (e.g. 2 isotropic sources fed in-phase or out-of-phase).",Antennas and Propagation,4. Arrays of point sources,"Summer 2022, Winter 2022, Winter 2022, Summer 2023, Winter 2023, Winter 2024, Summer 2025",7,6.14,,High,TRUE,Derive the expression for the far field pattern of an array of point sources (e.g. 2 isotropic sources fed in-phase or out-of-phase).
"In short, obtain the expression for the far field pattern of an array of point sources (e.g. 2 isotropic sources fed in-phase or out-of-phase).",Antennas and Propagation,4. Arrays of point sources,"Summer 2022, Winter 2022, Winter 2022, Summer 2023, Winter 2023, Winter 2024, Summer 2025",7,6.14,,High,TRUE,Derive the expression for the far field pattern of an array of point sources (e.g. 2 isotropic sources fed in-phase or out-of-phase).
"In short, derive the expression for the far field pattern of an array of point sources (e.g. 2 isotropic sources fed in-phase or out-of-phase).",Antennas and Propagation,4. Arrays of point sources,"Summer 2022, Winter 2022, Winter 2022, Summer 2023, Winter 2023, Winter 2024, Summer 2025",7,6.14,,High,TRUE,Derive the expression for the far field pattern of an array of point sources (e.g. 2 isotropic sources fed in-phase or out-of-phase).
Deduce the expression for the far field pattern of an array of point sources (e.g. 2 isotropic sources fed in-phase or out-of-phase).,Antennas and Propagation,4. Arrays of point sources,"Summer 2022, Winter 2022, Winter 2022, Summer 2023, Winter 2023, Winter 2024, Summer 2025",7,6.14,,High,TRUE,Derive the expression for the far field pattern of an array of point sources (e.g. 2 isotropic sources fed in-phase or out-of-phase).
"To summarize, obtain the expression for the far field pattern of an array of point sources (e.g. 2 isotropic sources fed in-phase or out-of-phase).",Antennas and Propagation,4. Arrays of point sources,"Summer 2022, Winter 2022, Winter 2022, Summer 2023, Winter 2023, Winter 2024, Summer 2025",7,6.14,,High,TRUE,Derive the expression for the far field pattern of an array of point sources (e.g. 2 isotropic sources fed in-phase or out-of-phase).
"To summarize, design a linear array with a spacing of d = lambda/6 such that it has zeros at theta = 0, 45, and 90 degrees using Schelkunoff's method.",Antennas and Propagation,4. Arrays of point sources,Winter 2023,1,7,,Low,TRUE,"Design a linear array with a spacing of d = lambda/6 such that it has zeros at theta = 0, 45, and 90 degrees using Schelkunoff's method."
"Briefly, design a linear array with a spacing of d = lambda/6 such that it has zeros at theta = 0, 45, and 90 degrees using Schelkunoff's method.",Antennas and Propagation,4. Arrays of point sources,Winter 2023,1,7,,Low,TRUE,"Design a linear array with a spacing of d = lambda/6 such that it has zeros at theta = 0, 45, and 90 degrees using Schelkunoff's method."
"In short, design a linear array with a spacing of d = lambda/6 such that it has zeros at theta = 0, 45, and 90 degrees using Schelkunoff's method.",Antennas and Propagation,4. Arrays of point sources,Winter 2023,1,7,,Low,TRUE,"Design a linear array with a spacing of d = lambda/6 such that it has zeros at theta = 0, 45, and 90 degrees using Schelkunoff's method."
"In brief, design a linear array with a spacing of d = lambda/6 such that it has zeros at theta = 0, 45, and 90 degrees using Schelkunoff's method.",Antennas and Propagation,4. Arrays of point sources,Winter 2023,1,7,,Low,TRUE,"Design a linear array with a spacing of d = lambda/6 such that it has zeros at theta = 0, 45, and 90 degrees using Schelkunoff's method."
"Concisely, design a linear array with a spacing of d = lambda/6 such that it has zeros at theta = 0, 45, and 90 degrees using Schelkunoff's method.",Antennas and Propagation,4. Arrays of point sources,Winter 2023,1,7,,Low,TRUE,"Design a linear array with a spacing of d = lambda/6 such that it has zeros at theta = 0, 45, and 90 degrees using Schelkunoff's method."
"Concisely, explain the effect of ground on ungrounded antenna.",Antennas and Propagation,4. Arrays of point sources,Summer 2022,1,3,,Low,TRUE,Explain the effect of ground on ungrounded antenna.
"To summarize, explain the effect of ground on ungrounded antenna.",Antennas and Propagation,4. Arrays of point sources,Summer 2022,1,3,,Low,TRUE,Explain the effect of ground on ungrounded antenna.
"Concisely, describe the effect of ground on ungrounded antenna.",Antennas and Propagation,4. Arrays of point sources,Summer 2022,1,3,,Low,TRUE,Explain the effect of ground on ungrounded antenna.
"Briefly, explain the effect of ground on ungrounded antenna.",Antennas and Propagation,4. Arrays of point sources,Summer 2022,1,3,,Low,TRUE,Explain the effect of ground on ungrounded antenna.
"To summarize, discuss the effect of ground on ungrounded antenna.",Antennas and Propagation,4. Arrays of point sources,Summer 2022,1,3,,Low,TRUE,Explain the effect of ground on ungrounded antenna.
"Concisely, explain the working principle and radiation resistance of small loop antenna.",Antennas and Propagation,5. Loop Antenna,"Summer 2022, Summer 2023, Winter 2024, Summer 2025, Winter 2025",5,5.8,,High,TRUE,Explain the working principle and radiation resistance of small loop antenna.
"In short, describe the working principle and radiation resistance of small loop antenna.",Antennas and Propagation,5. Loop Antenna,"Summer 2022, Summer 2023, Winter 2024, Summer 2025, Winter 2025",5,5.8,,High,TRUE,Explain the working principle and radiation resistance of small loop antenna.
"To summarize, discuss the working principle and radiation resistance of small loop antenna.",Antennas and Propagation,5. Loop Antenna,"Summer 2022, Summer 2023, Winter 2024, Summer 2025, Winter 2025",5,5.8,,High,TRUE,Explain the working principle and radiation resistance of small loop antenna.
"In short, explain the working principle and radiation resistance of small loop antenna.",Antennas and Propagation,5. Loop Antenna,"Summer 2022, Summer 2023, Winter 2024, Summer 2025, Winter 2025",5,5.8,,High,TRUE,Explain the working principle and radiation resistance of small loop antenna.
"Briefly, explain the working principle and radiation resistance of small loop antenna.",Antennas and Propagation,5. Loop Antenna,"Summer 2022, Summer 2023, Winter 2024, Summer 2025, Winter 2025",5,5.8,,High,TRUE,Explain the working principle and radiation resistance of small loop antenna.
"In brief, obtain the directivity of loop antennas for large loop.",Antennas and Propagation,5. Loop Antenna,Winter 2022,1,3,,Low,TRUE,Derive the directivity of loop antennas for large loop.
"Concisely, deduce the directivity of loop antennas for large loop.",Antennas and Propagation,5. Loop Antenna,Winter 2022,1,3,,Low,TRUE,Derive the directivity of loop antennas for large loop.
"Concisely, obtain the directivity of loop antennas for large loop.",Antennas and Propagation,5. Loop Antenna,Winter 2022,1,3,,Low,TRUE,Derive the directivity of loop antennas for large loop.
"Briefly, deduce the directivity of loop antennas for large loop.",Antennas and Propagation,5. Loop Antenna,Winter 2022,1,3,,Low,TRUE,Derive the directivity of loop antennas for large loop.
Deduce the directivity of loop antennas for large loop.,Antennas and Propagation,5. Loop Antenna,Winter 2022,1,3,,Low,TRUE,Derive the directivity of loop antennas for large loop.
"Concisely, discuss helical geometry, pitch angle, axial ratio, modes of radiation, and practical design considerations for helical antennas.",Antennas and Propagation,6. Helical antenna,"Winter 2021, Summer 2022, Winter 2022, Summer 2023, Summer 2024, Winter 2024, Winter 2024, Summer 2025, Winter 2025",9,4.22,,High,TRUE,"Explain helical geometry, pitch angle, axial ratio, modes of radiation, and practical design considerations for helical antennas."
"To summarize, discuss helical geometry, pitch angle, axial ratio, modes of radiation, and practical design considerations for helical antennas.",Antennas and Propagation,6. Helical antenna,"Winter 2021, Summer 2022, Winter 2022, Summer 2023, Summer 2024, Winter 2024, Winter 2024, Summer 2025, Winter 2025",9,4.22,,High,TRUE,"Explain helical geometry, pitch angle, axial ratio, modes of radiation, and practical design considerations for helical antennas."
"In short, describe helical geometry, pitch angle, axial ratio, modes of radiation, and practical design considerations for helical antennas.",Antennas and Propagation,6. Helical antenna,"Winter 2021, Summer 2022, Winter 2022, Summer 2023, Summer 2024, Winter 2024, Winter 2024, Summer 2025, Winter 2025",9,4.22,,High,TRUE,"Explain helical geometry, pitch angle, axial ratio, modes of radiation, and practical design considerations for helical antennas."
"To summarize, explain helical geometry, pitch angle, axial ratio, modes of radiation, and practical design considerations for helical antennas.",Antennas and Propagation,6. Helical antenna,"Winter 2021, Summer 2022, Winter 2022, Summer 2023, Summer 2024, Winter 2024, Winter 2024, Summer 2025, Winter 2025",9,4.22,,High,TRUE,"Explain helical geometry, pitch angle, axial ratio, modes of radiation, and practical design considerations for helical antennas."
"In short, explain helical geometry, pitch angle, axial ratio, modes of radiation, and practical design considerations for helical antennas.",Antennas and Propagation,6. Helical antenna,"Winter 2021, Summer 2022, Winter 2022, Summer 2023, Summer 2024, Winter 2024, Winter 2024, Summer 2025, Winter 2025",9,4.22,,High,TRUE,"Explain helical geometry, pitch angle, axial ratio, modes of radiation, and practical design considerations for helical antennas."
"Briefly, describe the construction, operation, and design of Yagi-Uda antenna.",Antennas and Propagation,7. Arrays of dipoles & apertures,"Winter 2021, Summer 2022, Winter 2022, Summer 2023, Winter 2023, Summer 2024, Winter 2024, Summer 2025, Winter 2025",9,4.22,,High,TRUE,"Explain the construction, operation, and design of Yagi-Uda antenna."
"Briefly, discuss the construction, operation, and design of Yagi-Uda antenna.",Antennas and Propagation,7. Arrays of dipoles & apertures,"Winter 2021, Summer 2022, Winter 2022, Summer 2023, Winter 2023, Summer 2024, Winter 2024, Summer 2025, Winter 2025",9,4.22,,High,TRUE,"Explain the construction, operation, and design of Yagi-Uda antenna."
"In short, discuss the construction, operation, and design of Yagi-Uda antenna.",Antennas and Propagation,7. Arrays of dipoles & apertures,"Winter 2021, Summer 2022, Winter 2022, Summer 2023, Winter 2023, Summer 2024, Winter 2024, Summer 2025, Winter 2025",9,4.22,,High,TRUE,"Explain the construction, operation, and design of Yagi-Uda antenna."
"To summarize, discuss the construction, operation, and design of Yagi-Uda antenna.",Antennas and Propagation,7. Arrays of dipoles & apertures,"Winter 2021, Summer 2022, Winter 2022, Summer 2023, Winter 2023, Summer 2024, Winter 2024, Summer 2025, Winter 2025",9,4.22,,High,TRUE,"Explain the construction, operation, and design of Yagi-Uda antenna."
"Concisely, discuss the construction, operation, and design of Yagi-Uda antenna.",Antennas and Propagation,7. Arrays of dipoles & apertures,"Winter 2021, Summer 2022, Winter 2022, Summer 2023, Winter 2023, Summer 2024, Winter 2024, Summer 2025, Winter 2025",9,4.22,,High,TRUE,"Explain the construction, operation, and design of Yagi-Uda antenna."
"To summarize, along with necessary figure explain the principle of Folded dipole.",Antennas and Propagation,7. Arrays of dipoles & apertures,"Winter 2021, Summer 2022, Winter 2022, Summer 2024, Winter 2025",5,3.6,,High,TRUE,Along with necessary figure explain the principle of Folded dipole.
"Briefly, along with necessary figure explain the principle of Folded dipole.",Antennas and Propagation,7. Arrays of dipoles & apertures,"Winter 2021, Summer 2022, Winter 2022, Summer 2024, Winter 2025",5,3.6,,High,TRUE,Along with necessary figure explain the principle of Folded dipole.
"Concisely, along with necessary figure explain the principle of Folded dipole.",Antennas and Propagation,7. Arrays of dipoles & apertures,"Winter 2021, Summer 2022, Winter 2022, Summer 2024, Winter 2025",5,3.6,,High,TRUE,Along with necessary figure explain the principle of Folded dipole.
"In short, along with necessary figure explain the principle of Folded dipole.",Antennas and Propagation,7. Arrays of dipoles & apertures,"Winter 2021, Summer 2022, Winter 2022, Summer 2024, Winter 2025",5,3.6,,High,TRUE,Along with necessary figure explain the principle of Folded dipole.
"In brief, along with necessary figure explain the principle of Folded dipole.",Antennas and Propagation,7. Arrays of dipoles & apertures,"Winter 2021, Summer 2022, Winter 2022, Summer 2024, Winter 2025",5,3.6,,High,TRUE,Along with necessary figure explain the principle of Folded dipole.
Explain in depth about frequency scanning arrays.,Antennas and Propagation,7. Arrays of dipoles & apertures,Summer 2022,1,7,,Low,TRUE,Explain in detail about frequency scanning arrays.
"In short, explain in detail about frequency scanning arrays.",Antennas and Propagation,7. Arrays of dipoles & apertures,Summer 2022,1,7,,Low,TRUE,Explain in detail about frequency scanning arrays.
"Briefly, describe in detail about frequency scanning arrays.",Antennas and Propagation,7. Arrays of dipoles & apertures,Summer 2022,1,7,,Low,TRUE,Explain in detail about frequency scanning arrays.
"To summarize, describe in detail about frequency scanning arrays.",Antennas and Propagation,7. Arrays of dipoles & apertures,Summer 2022,1,7,,Low,TRUE,Explain in detail about frequency scanning arrays.
"To summarize, explain in depth about frequency scanning arrays.",Antennas and Propagation,7. Arrays of dipoles & apertures,Summer 2022,1,7,,Low,TRUE,Explain in detail about frequency scanning arrays.
"Concisely, describe various types of antennas with their applications.",Antennas and Propagation,7. Arrays of dipoles & apertures,Summer 2023,1,7,,Low,TRUE,Explain various types of antennas with their applications.
Discuss various types of antennas with their applications.,Antennas and Propagation,7. Arrays of dipoles & apertures,Summer 2023,1,7,,Low,TRUE,Explain various types of antennas with their applications.
"In brief, explain various types of antennas with their applications.",Antennas and Propagation,7. Arrays of dipoles & apertures,Summer 2023,1,7,,Low,TRUE,Explain various types of antennas with their applications.
"In short, discuss various types of antennas with their applications.",Antennas and Propagation,7. Arrays of dipoles & apertures,Summer 2023,1,7,,Low,TRUE,Explain various types of antennas with their applications.
"Concisely, explain various types of antennas with their applications.",Antennas and Propagation,7. Arrays of dipoles & apertures,Summer 2023,1,7,,Low,TRUE,Explain various types of antennas with their applications.
"Concisely, explain smart antennas.",Antennas and Propagation,7. Arrays of dipoles & apertures,Winter 2021,1,4,,Low,TRUE,Describe smart antennas.
